{"schema_version":"plan-11-26-duplication-audit-v1","source_commit":"b62462f11abe858f58af12fa2d2f159eae09d832","inventory_digest":"193cc3f963aee9515b2828fbac734a6fb3dda228af31845b3205f6a2084c1797","frozen_task12_artifacts":[{"path":"reports/plan-11-26-baseline-intake.json","sha256":"7027d5be9522e320e1b2a0e3e2839479f39875bf395d94603d25386cff2552d2"},{"path":"reports/plan-11-26-acp-runtime-audit.json","sha256":"8dc32bf425c501c1a2ec8282b0c68754839c1662dbf38f36fc109b3b4b7815df"},{"path":"reports/plan-11-26-acp-runtime-audit.md","sha256":"49f7906be60160ef866b57fc9526e7e4488cc61eab61a3b5c216406804ee769c"},{"path":"reports/plan-11-26-terminal-characterization.md","sha256":"114efaa96d2ca5f08cbcd9abeb9719b518b7cc39de14d0d4d5827f5f28aa999d"}],"reviewed_partitions":[{"partition_id":"partition-001","raw_group_id":"group-048d7f8e2810633908ec","member_ids":["member-2dfdbb46d0389c3071ff","member-f6df5f55b9c7acfd29d9"],"disposition":"CONFIRMED_DUPLICATION","rationale":"Redaction cleanup, containment, hashing, and count aggregation is repeated across 2 independently maintained module paths; FEATURE_SIMILARITY evidence and qualified responsibilities establish one drift-prone contract.","finding_id":"T13-FIND-001","candidate_id":"T13-CAND-REDACTION-LIFETIME"},{"partition_id":"partition-002","raw_group_id":"group-055711dfd53ac37a4aba","member_ids":["member-205d6cd2a243be4e1fce","member-aae6b7dd403cfe58fa77"],"disposition":"INTENTIONAL_REPETITION","rationale":"These symbols are parallel variants, adapters, protocol methods, or fixed platform bindings in local APIs; repetition is deliberate and preserves separate boundary ownership.","finding_id":null,"candidate_id":null},{"partition_id":"partition-003","raw_group_id":"group-07118eba6cb5defb3cbf","member_ids":["member-3cd982e730395cec13d5","member-9d5bc2cf460482644bf3","member-df0cb1f82b23af9200ce"],"disposition":"INTENTIONAL_REPETITION","rationale":"These symbols are parallel variants, adapters, protocol methods, or fixed platform bindings in local APIs; repetition is deliberate and preserves separate boundary ownership.","finding_id":null,"candidate_id":null},{"partition_id":"partition-004","raw_group_id":"group-07c696ba2b8abfa82b66","member_ids":["member-796544d4996a24a6390a","member-b2856b4007383da0722e"],"disposition":"INTENTIONAL_REPETITION","rationale":"These symbols are parallel variants, adapters, protocol methods, or fixed platform bindings in local APIs; repetition is deliberate and preserves separate boundary ownership.","finding_id":null,"candidate_id":null},{"partition_id":"partition-005","raw_group_id":"group-09b7953360b416a212f7","member_ids":["member-0749f75ec2248f600193","member-16dbf665b4540e3d2b62","member-cea3ba2889d4ec5e110f"],"disposition":"CONFIRMED_DUPLICATION","rationale":"Audit-tool canonicalization, symbol, citation, and visitor helpers is repeated across 3 independently maintained module paths; FEATURE_SIMILARITY evidence and qualified responsibilities establish one drift-prone contract.","finding_id":"T13-FIND-002","candidate_id":"T13-CAND-AUDIT-PRIMITIVES"},{"partition_id":"partition-006","raw_group_id":"group-0a96d16abfc76f13e7fa","member_ids":["member-c51f829e31e201ac3f58","member-fbb0259df271332cac35"],"disposition":"CONFIRMED_DUPLICATION","rationale":"Evidence-runner helpers and pinned contract values is repeated across 2 independently maintained module paths; FEATURE_SIMILARITY evidence and qualified responsibilities establish one drift-prone contract.","finding_id":"T13-FIND-003","candidate_id":"T13-CAND-RUNNER-CONTRACTS"},{"partition_id":"partition-007","raw_group_id":"group-0bf8a8a4da9d6db376e1","member_ids":["member-84afe2e2fbf42ed78157","member-a89c4585c1dde627c188"],"disposition":"CONFIRMED_DUPLICATION","rationale":"Evidence-runner helpers and pinned contract values is repeated across 2 independently maintained module paths; AST_SHAPE_EQUAL evidence and qualified responsibilities establish one drift-prone contract.","finding_id":"T13-FIND-004","candidate_id":"T13-CAND-RUNNER-CONTRACTS"},{"partition_id":"partition-008","raw_group_id":"group-0c9d95b9a54100c7b0af","member_ids":["member-2ed11f7f1fa3cd66fdad","member-9c48a4e1a61a9d06df48"],"disposition":"CONFIRMED_DUPLICATION","rationale":"Evidence-runner helpers and pinned contract values is repeated across 2 independently maintained module paths; FEATURE_SIMILARITY evidence and qualified responsibilities establish one drift-prone contract.","finding_id":"T13-FIND-005","candidate_id":"T13-CAND-RUNNER-CONTRACTS"},{"partition_id":"partition-009","raw_group_id":"group-0d8f4a3312f903a6c3f4","member_ids":["member-43788d379f5a538dcc58","member-55454dd9651aae845f9a"],"disposition":"INTENTIONAL_REPETITION","rationale":"These symbols are parallel variants, adapters, protocol methods, or fixed platform bindings in local APIs; repetition is deliberate and preserves separate boundary ownership.","finding_id":null,"candidate_id":null},{"partition_id":"partition-010","raw_group_id":"group-149be5bd12a4b5766c6f","member_ids":["member-34c17e32c30531aeba2e","member-bade7d540cd2f9a05427","member-c62389a08d624dc8780b","member-eaf4352cd2847f126fbc"],"disposition":"INTENTIONAL_REPETITION","rationale":"These symbols are parallel variants, adapters, protocol methods, or fixed platform bindings in local APIs; repetition is deliberate and preserves separate boundary ownership.","finding_id":null,"candidate_id":null},{"partition_id":"partition-011","raw_group_id":"group-19b650e5dbf6368f1458","member_ids":["member-3d8d585ab606f87c6f82","member-8ea03db10cdfb58b73af","member-c836712febb0e6af645a"],"disposition":"CONFIRMED_DUPLICATION","rationale":"Audit-tool canonicalization, symbol, citation, and visitor helpers is repeated across 3 independently maintained module paths; AST_SHAPE_EQUAL evidence and qualified responsibilities establish one drift-prone contract.","finding_id":"T13-FIND-006","candidate_id":"T13-CAND-AUDIT-PRIMITIVES"},{"partition_id":"partition-012","raw_group_id":"group-1a5753389e3825aa4cba","member_ids":["member-888bbf5cdda96c6955e4","member-febf9fb240382d91f6b0"],"disposition":"INTENTIONAL_REPETITION","rationale":"These symbols are parallel variants, adapters, protocol methods, or fixed platform bindings in local APIs; repetition is deliberate and preserves separate boundary ownership.","finding_id":null,"candidate_id":null},{"partition_id":"partition-013","raw_group_id":"group-1e1a14e9dc2dc9b3da6c","member_ids":["member-6e092607d0450cb9a945","member-798b7564c5e0bd836ee0","member-f53581982576f0dfe698"],"disposition":"INTENTIONAL_REPETITION","rationale":"These symbols are parallel variants, adapters, protocol methods, or fixed platform bindings in local APIs; repetition is deliberate and preserves separate boundary ownership.","finding_id":null,"candidate_id":null},{"partition_id":"partition-014","raw_group_id":"group-1f21f7273ef77af7fd92","member_ids":["member-24e8724d5ed1568b4c09","member-43343f424daed3f5bf0f"],"disposition":"INTENTIONAL_REPETITION","rationale":"These symbols are parallel variants, adapters, protocol methods, or fixed platform bindings in local APIs; repetition is deliberate and preserves separate boundary ownership.","finding_id":null,"candidate_id":null},{"partition_id":"partition-015","raw_group_id":"group-20a2716adba20c901b0b","member_ids":["member-0a4a3b444e6f804d8c04","member-53035ba034baa836e564"],"disposition":"INTENTIONAL_REPETITION","rationale":"These symbols are parallel variants, adapters, protocol methods, or fixed platform bindings in local APIs; repetition is deliberate and preserves separate boundary ownership.","finding_id":null,"candidate_id":null},{"partition_id":"partition-016","raw_group_id":"group-2397b1424ab2df61d00c","member_ids":["member-3206dde60a0395d31a6b","member-35c09d59a6f56bcacd82"],"disposition":"STRUCTURAL_SIMILARITY_ONLY","rationale":"AST_SHAPE_EQUAL joins append, but qualified paths and responsibilities are semantically distinct; shape, name, or value equality alone does not prove shared ownership.","finding_id":null,"candidate_id":null},{"partition_id":"partition-017","raw_group_id":"group-23ddb82a15871939344d","member_ids":["member-0a021148127978723ede","member-8c631832eee2c7e82ee3"],"disposition":"INTENTIONAL_REPETITION","rationale":"These symbols are parallel variants, adapters, protocol methods, or fixed platform bindings in local APIs; repetition is deliberate and preserves separate boundary ownership.","finding_id":null,"candidate_id":null},{"partition_id":"partition-018","raw_group_id":"group-28d14cc414071015131c","member_ids":["member-490a6e312fe0d5c6905c","member-83c446a3a08670985522"],"disposition":"INTENTIONAL_REPETITION","rationale":"These symbols are parallel variants, adapters, protocol methods, or fixed platform bindings in local APIs; repetition is deliberate and preserves separate boundary ownership.","finding_id":null,"candidate_id":null},{"partition_id":"partition-019","raw_group_id":"group-2aeba8467b8c024dedc6","member_ids":["member-2759718037ec1764e18f","member-55b9374edd13be4d6b94","member-9c2582afa8ed6e8162d6","member-9d5d1f120ae44fcc7925"],"disposition":"INTENTIONAL_REPETITION","rationale":"These symbols are parallel variants, adapters, protocol methods, or fixed platform bindings in local APIs; repetition is deliberate and preserves separate boundary ownership.","finding_id":null,"candidate_id":null},{"partition_id":"partition-020","raw_group_id":"group-2b052c33f035cbeb7856","member_ids":["member-13fb552ea0ae96a52149","member-21b6f8bbe885f1bf2671","member-a82206461942503cf653"],"disposition":"CONFIRMED_DUPLICATION","rationale":"Redaction cleanup, containment, hashing, and count aggregation is repeated across 3 independently maintained module paths; AST_SHAPE_EQUAL evidence and qualified responsibilities establish one drift-prone contract.","finding_id":"T13-FIND-007","candidate_id":"T13-CAND-REDACTION-LIFETIME"},{"partition_id":"partition-021","raw_group_id":"group-2d6d1f53e693eba6c117","member_ids":["member-1e2922fb1fa9032ae